{
  "schema": "https://goose-skills.spacia.ai/schemas/index/v1.json",
  "version": 1,
  "generated_at": "2026-05-23T08:44:17.117Z",
  "registry_url": "https://github.com/spacia-ai/goose-skills",
  "skills": [
    {
      "name": "code-review",
      "path": "standalone/code-review",
      "description": "Review code changes for correctness, security, and reliability — focused, citation-style, no nitpicking.",
      "extensions": [],
      "requires": [],
      "tools": [
        "developer__shell",
        "developer__text_editor"
      ],
      "tags": [
        "code",
        "review",
        "security",
        "reliability",
        "standalone"
      ],
      "min_goose_version": "1.33.0",
      "isolated": false,
      "files": [
        {
          "path": "references/category-checklist.md",
          "sha256": "ebb926d898af827862305162e55651f969977d8cf34b3c1e95172ebbc89b7ff7",
          "size": 3052
        },
        {
          "path": "SKILL.md",
          "sha256": "5c6f4a076cde2e0f4d07a6d833c2e5a81c10f6b137bd983ac078d343f1bff641",
          "size": 2590
        }
      ],
      "files_sha256": "926201153249f85791c3443e0fda054706724724c1a2eb3ded744e29dde78a2f"
    },
    {
      "name": "debugging-rust",
      "path": "standalone/debugging-rust",
      "description": "Debug Rust compile errors, lifetime issues, and runtime panics. Cargo invocation patterns + idiomatic fixes.",
      "extensions": [],
      "requires": [],
      "tools": [
        "developer__shell",
        "developer__text_editor"
      ],
      "tags": [
        "rust",
        "debugging",
        "compiler",
        "standalone"
      ],
      "min_goose_version": "1.33.0",
      "isolated": false,
      "files": [
        {
          "path": "references/error-patterns.md",
          "sha256": "a085584905aeca9bf3b234a45688c274203fac56e8c1b837d162121a4257e36b",
          "size": 3915
        },
        {
          "path": "SKILL.md",
          "sha256": "cdf3dc714527d1c7b9f0a42150d3f4650e569968f5456b8e34497044732d8b68",
          "size": 2915
        }
      ],
      "files_sha256": "32099098467ac101180775ff1f174ab4a6c4067d536c5419ff695a1920a6dde4"
    },
    {
      "name": "exa",
      "path": "extensions/exa",
      "description": "Operator's manual for the Exa web-research MCP — when to search, how to dereference, citation patterns.",
      "extensions": [
        "exa"
      ],
      "requires": [
        "exa"
      ],
      "tools": [
        "exa__web_search_exa",
        "exa__crawling_exa",
        "exa__research_paper_search_exa",
        "exa__company_research_exa",
        "exa__github_search_exa",
        "exa__wikipedia_search_exa",
        "exa__linkedin_search_exa"
      ],
      "tags": [
        "search",
        "web",
        "research",
        "extension-skill"
      ],
      "min_goose_version": "1.33.0",
      "isolated": false,
      "files": [
        {
          "path": "references/search-patterns.md",
          "sha256": "a53eea519c0b23c1c64713e716245e6e75d6c0aaf1672ea0063a32aca383a714",
          "size": 2801
        },
        {
          "path": "SKILL.md",
          "sha256": "4df7912fe243e89d4fd0796ab58358f37800b0e35b05f5788a09fa908656c41f",
          "size": 3614
        }
      ],
      "files_sha256": "85d24ca5866bf8f0a81ceb1bc25009ba4ef021a563ddfb985abc13657a953ab4"
    },
    {
      "name": "frontend-design",
      "path": "standalone/frontend-design",
      "description": "Create distinctive, production-grade frontend interfaces with high design quality. Use this skill when the user asks to build web components, pages, or applications. Generates creative, polished code that avoids generic AI aesthetics.",
      "extensions": [],
      "requires": [],
      "tools": [
        "developer__shell",
        "developer__text_editor"
      ],
      "tags": [
        "frontend",
        "design",
        "aesthetics",
        "ui",
        "components",
        "standalone"
      ],
      "min_goose_version": "1.33.0",
      "isolated": false,
      "files": [
        {
          "path": "LICENSE",
          "sha256": "cfc7749b96f63bd31c3c42b5c471bf756814053e847c10f3eb003417bc523d30",
          "size": 11358
        },
        {
          "path": "SKILL.md",
          "sha256": "3f21b34890e8727dedac29135ddf8ff0c5b72136f34a2691d9755da1992b7e2e",
          "size": 4467
        }
      ],
      "files_sha256": "401e8a57e987dadb409420b5abd161d00dbc925967b9f4655e6a2526c1619e5e"
    },
    {
      "name": "frontend-ux-engineering",
      "path": "standalone/frontend-ux-engineering",
      "description": "Use when designing, building, auditing, reviewing, or shipping any web UI where standards, accessibility, performance, or measured quality matter. Triggers on intents like \"audit this UI\", \"is this accessible\", \"WCAG\", \"Core Web Vitals\", \"INP/LCP/CLS\", \"passkeys\", \"privacy notice\", \"design tokens\", \"AI feature UX\", \"form error recovery\", \"data table\", \"dashboard\", \"skeleton vs spinner\", and on general \"build/improve/review a web app\" prompts. Pairs with frontend-design — this skill owns standards, semantics, performance, trust, research, and delivery; frontend-design owns aesthetic execution. Use this skill before frontend-design on greenfield work so the UX/standards layer is locked first.",
      "extensions": [],
      "requires": [],
      "tools": [
        "developer__shell",
        "developer__text_editor"
      ],
      "tags": [
        "frontend",
        "ux",
        "accessibility",
        "performance",
        "wcag",
        "core-web-vitals",
        "standalone"
      ],
      "min_goose_version": "1.33.0",
      "isolated": false,
      "files": [
        {
          "path": "references/checklists/ai-feature-ux.md",
          "sha256": "3fa2bc6bd9a481eb83a3772be867153770ddc816a383715de785d950e0aa599b",
          "size": 6631
        },
        {
          "path": "references/checklists/auth-passkeys.md",
          "sha256": "6002d0197be316b6e99ed93a5958c8033825859da4852032353ef96f0489f314",
          "size": 6077
        },
        {
          "path": "references/checklists/core-web-vitals.md",
          "sha256": "eb082e2d8a348c51c81e1e086a2cbaf3549498b5e5f05eed69f88bcd8a01e471",
          "size": 4973
        },
        {
          "path": "references/checklists/forms-recovery.md",
          "sha256": "0578c2fc82b774da9fad993c8f4759b135008f02c4ef4ebb988230904ea26d24",
          "size": 5828
        },
        {
          "path": "references/checklists/wcag-22-aa.md",
          "sha256": "9f09ca4a733dae0813b685802d5068cf6b512bd969a78f6be94e2adbe4066c92",
          "size": 8519
        },
        {
          "path": "references/domains/accessibility.md",
          "sha256": "e1f94b18a1d285774668858007c1bb74b707bd29e1edbfbda716c23410b4b70d",
          "size": 11074
        },
        {
          "path": "references/domains/ai-ux.md",
          "sha256": "c2f3dce184ef427aeef1cf6257600906f1ffa971d750d97aa07f6762f52d8a1b",
          "size": 10208
        },
        {
          "path": "references/domains/delivery.md",
          "sha256": "5362c3cd08dfb58914d41f606d8dc204fb4432fe7a971aa3b8313b52e168a05e",
          "size": 11576
        },
        {
          "path": "references/domains/patterns.md",
          "sha256": "2853ec2bea157a1ccd825653bdfa200f3f1e3de59240b6465ba15b6a961fbaa5",
          "size": 11793
        },
        {
          "path": "references/domains/performance.md",
          "sha256": "e3241a508a59ffc7f2f63286ba645332d7f7da065ec6ce354a9dab700460648d",
          "size": 10091
        },
        {
          "path": "references/domains/research.md",
          "sha256": "feeb4c858e0bd7dc1c582e1ec1b8cb4fc85dcc58a050147cfdfe9003ab11b21f",
          "size": 10170
        },
        {
          "path": "references/domains/trust.md",
          "sha256": "5bae6fbd73bb9ae22b2cc8f453c3e010ea8de4fbfa4b46e7d886cde013441bd1",
          "size": 9457
        },
        {
          "path": "references/handoff/frontend-design-pairing.md",
          "sha256": "1ae190d510e4097f9cfd60b02ec8fa594c8f48c210b2af3a61db85599e34daca",
          "size": 9615
        },
        {
          "path": "references/modes/audit.md",
          "sha256": "f72a7b5d33c8b5da876ecdaf26e1401c4e7bc3da4ebf6b35251e25b1bf2510a3",
          "size": 9961
        },
        {
          "path": "references/modes/build.md",
          "sha256": "0aa7e04f37b65fee1dba7c0ae49dd71b4f24954090bc2f3db8367784a25bff5c",
          "size": 10954
        },
        {
          "path": "references/modes/gate.md",
          "sha256": "af323b673aaa9715564c29b1afc1cbf44cbd7bb6f95af0941fbe41662f0f63c4",
          "size": 7147
        },
        {
          "path": "references/modes/learn.md",
          "sha256": "9b43c7206c0f0b0aa63732cdd7e6f672e6396bdb7f0902dc604d126b6f10763f",
          "size": 12601
        },
        {
          "path": "references/stacks/angular.md",
          "sha256": "6ef69c11e7fbd84312219efa882fdd2d9f1dacd95ded6d6b767f92284bc72384",
          "size": 2159
        },
        {
          "path": "references/stacks/astro.md",
          "sha256": "c3d2dfbd3b032420aff156c3b391aa97695fe3f7c61311107b5f801b99139d0e",
          "size": 2911
        },
        {
          "path": "references/stacks/react.md",
          "sha256": "91a1b5d38b7669134648b1ca684336740db11fc2413ed2aa65b84f88d4e522cb",
          "size": 17628
        },
        {
          "path": "references/stacks/server-rendered.md",
          "sha256": "0bd1d4abd666bd1fc511cb4c6ceb38d0e968ad9c79dc7f27818beab46461815d",
          "size": 4964
        },
        {
          "path": "references/stacks/solid.md",
          "sha256": "1e538d75638b8f18b26e749ee26e6bc6ea795c721eca33d0b72b56c5b0c7f326",
          "size": 2002
        },
        {
          "path": "references/stacks/svelte.md",
          "sha256": "2f4e28835c3061e915990b661e8da14e88cc33d4ba4d041b2b9d6c0a6f693c06",
          "size": 2668
        },
        {